Typ výstupu	Rok	Název	Autor	Fakulta	Katedra	DOI	ISSN	Časopis	ISBN	RIV ID	Číslo na RIV	Poznámka
Jimp	2025	Machine learning approaches in education	Novák Jan	FIM	Katedra informatiky	10.1234/example.2025	1234-5678	Journal of Applied AI			RIV-2025-001		Příklad importu
JSC	2024	Regional development perspectives	Svobodová Marie	FF	Katedra geografie				Regional Studies Review			RIV-2024-042	
B	2023	Dějiny regionu v kontextu globalizace	Procházka Petr	FHK		978-80-1234-567-8			978-80-1234-567-8	RIV-2023-100		
C	2024	Kapitola o metodologii výzkumu	Horáková Eva	PDF	Katedra pedagogiky					978-80-9876-543-2	RIV-2024-055	Kapitola v monografii
D	2025	Užitný vzor — senzorický modul pro monitoring		Kovář Tomáš	FSV	Katedra kriminalistiky						RIV-2025-200	Aplikovaný výsledek
